{
  "schema_version": 1,
  "ap_per_level": 5,
  "sp_per_level": 3,
  "starting_ap": 0,
  "base_stats": { "str": 4, "dex": 4, "int": 4, "luk": 4 },
  "crit_base_rate": 0.05,
  "crit_multiplier": 1.5,
  "mastery_base": 0.15,
  "defense_factor": 0.5,
  "level_diff_damage_penalty_per_level": 0.02,
  "hp_regen_interval_s": 10,
  "mp_regen_interval_s": 10,
  "death_exp_loss_pct": 0.05,
  "invincibility_after_hit_s": 1.2,
  "base_weapon_attack": 140,
  "base_defense": 0,
  "mob_skill_attack": 12,
  "movement": {
    "walk_speed": 125,
    "accel": 1400,
    "decel": 1800,
    "air_control": 0.2,
    "jump_velocity": -330,
    "gravity": 1000,
    "max_fall": 600,
    "climb_speed": 80,
    "coyote_ticks": 5,
    "jump_buffer_ticks": 6,
    "drop_through_ticks": 12
  }
}
